{"generated_at_utc":"2026-09-12T02:41:26Z","prerequisites":[{"code":"REPOSITORY_READINESS","status":"NEEDS_RUNWAY"},{"code":"PROTECTED_PROJECT_PROFILE","status":"READY"},{"code":"PROTECTED_ASSET_CATALOG","status":"READY"},{"code":"ORIGINAL_SOURCE_INVENTORY","status":"NEEDS_RUNWAY"},{"code":"EVIDENCE_LEDGER","status":"NEEDS_RUNWAY"},{"code":"MODEL13_AUTHORITY","status":"READY"},{"code":"APP01_INPUT_PACKAGE","status":"READY"},{"code":"MODEL14_PRESERVATION","status":"READY"},{"code":"MODEL15_PRESERVATION","status":"READY"},{"code":"FRESH_SESSION_RECOVERY","status":"READY"}],"preservation":{"model14":"PRESERVED","model15":"PRESERVED"},"protected_state":{"app01_inputs":"REGISTERED_RECOVERABLE","asset_catalog":"READY","evidence_ledger":"INCOMPLETE","model13_authority":"REGISTERED_RECOVERABLE","original_source_inventory":"INCOMPLETE","project_profile":"READY"},"recovery":{"fresh_session":"SUCCEEDED"},"repository":{"active_initiatives":[{"initiative_id":"GOV-02","push_state":"UNKNOWN","worktree_state":"CLEAN"},{"initiative_id":"GOV-03","push_state":"UNKNOWN","worktree_state":"CLEAN"},{"initiative_id":"GOV-04","push_state":"UNKNOWN","worktree_state":"CLEAN"},{"initiative_id":"GOV-05","push_state":"UNKNOWN","worktree_state":"CLEAN"},{"initiative_id":"GOV-06","push_state":"UNKNOWN","worktree_state":"CLEAN"},{"initiative_id":"GOV-07","push_state":"UNKNOWN","worktree_state":"CLEAN"},{"initiative_id":"GOV-09","push_state":"UNPUSHED_SAFE_WORK","worktree_state":"CLEAN"},{"initiative_id":"GOV-10","push_state":"UNPUSHED_SAFE_WORK","worktree_state":"CLEAN"},{"initiative_id":"GOV-11","push_state":"UNPUSHED_SAFE_WORK","worktree_state":"CLEAN"},{"initiative_id":"GOV-16","push_state":"SYNCHRONIZED","worktree_state":"CLEAN"},{"initiative_id":"MODEL-14","push_state":"SYNCHRONIZED","worktree_state":"CLEAN"},{"initiative_id":"MODEL-15","push_state":"UNKNOWN","worktree_state":"KNOWN_PRESERVED_WORK"},{"initiative_id":"PBI-01","push_state":"SYNCHRONIZED","worktree_state":"CLEAN"},{"initiative_id":"PBI-02","push_state":"SYNCHRONIZED","worktree_state":"CLEAN"}],"safe_work":[{"initiative_id":"GOV-09","state":"UNPUSHED"},{"initiative_id":"GOV-10","state":"UNPUSHED"},{"initiative_id":"GOV-11","state":"UNPUSHED"},{"initiative_id":"MODEL-15","state":"UNCOMMITTED"}],"verified_commit":"71beaa5e3d82625de9aa2c300dca3a56ff2a9399","worktree_state":"ATTENTION_NEEDED"},"schema_version":"1.0.0","snapshot_id":"development-readiness-v1"}
